House On Henry (Carroll Gardens Living) Ste 2,40.67813,-74.00062,201
CHARMING CARROLL GARDENS APT.,40.68028,-73.99328,190
House On Henry (Carroll Gardens Living) Ste 3,40.67747,-74.00146,222
"3 BR, Beautiful Brooklyn Duplex",40.68194,-73.99708,350
Carroll Gardens Gem-2BD with Garden,40.67933,-73.995,275
Luxe Townhome with Roof Terrace | Family Friendly,40.68461,-73.98984,600
Gorgeous 2 bdrm in Carroll Gardens,40.6748,-74.00032,150
Brownstone Home - BEST BKLYN BLOCK!,40.68461,-73.98923,239
Private Two Bedroom with Garden in Cobble Hill,40.68176,-73.99473,235
Luxury 1BD in Historic Carrol Gardens Brownstone,40.68023,-73.99375,90
"Modern, Carroll Garden Townhouse",40.68272,-73.99204,350
"Convenient, Renovated 2 Bedroom",40.67813,-73.99398,250
Prime brownstone with lush backyard,40.68322,-73.99684,450
Family-Friendly 3 BR in Cobble Hill,40.68338,-73.99011,284
Lovely Brooklyn Brownstone  one block from Subway,40.68451,-73.99037,450
"Sunny Duplex w/ Outdoor Space, Big Views and Quiet",40.68324,-73.99482,359
Charming Studio in Brooklyn,40.68169,-73.99709,44
"Huge, Beautiful & Minutes From NYC",40.67876,-74.00087,199
The Perfect 1-bedroom in Cobble Hill,40.68317,-73.99083,125
Spacious + Sunny in Carroll Gardens,40.68256,-74.00035,185
Sunny luxury in Bklyn's best hood,40.68374,-73.99134,215
Stylish Spacious w Lrge Deck 11231,40.67955,-73.99547,150
Carroll Gardens Brownstone,40.68356,-73.99213,350
Carroll Gardens Brooklyn Apartment,40.67757,-73.99666,149
Carroll Gardens townhouse,40.67997,-74.00156,325
Private Apt in Trendy Cobble Hill,40.68452,-73.99093,135
Perfect work-from-home for music-loving creatives,40.68145,-74.0014,301
1BD on Smith St. in Carroll Gardens,40.68238,-73.99481,150
Private 3 Floor Whole Hse/Garden,40.68352,-73.99234,425
"Modern loft in Cobble Hill, BK",40.6847,-73.9911,125
COMFORTABLE PRIVATE BEDROOM YOU'LL LOVE - 1 GUEST,40.68274,-73.99252,88
Brooklyn Carroll Gardens Charmer!,40.6829,-73.99925,175
Charming Studio in Carroll Gardens,40.68249,-73.99666,100
"Fresh, Quite and Poppin.",40.68234,-73.9932,65
Holiday Sublet in Carroll Gardens,40.67725,-73.99968,100
"Sunny, Spacious, Perfect Location!",40.68223,-73.99595,109
Short Walk From Brooklyn Bridge,40.68328758761574,-74.00097881646168,100
Large room w its own bathroom (& bath),40.67678,-73.99708,45
Best of Carroll Gardens,40.67778,-73.99402,350
Spacious room w/private roof deck,40.67828,-73.99605,175
Charming Brooklyn 1BD+Den,40.68324,-73.99706,125
"Family Friendly, Brooklyn, NYC 2br",40.68018,-74.00058,130
Floorthru Two Bed & Private Yard,40.68136,-74.00012,275
Private room in quintessential BK!,40.67416,-73.99955,40
1B Entire Apartment in Brooklyn,40.68478,-73.98971,220
Country House in the City,40.68393,-73.9948,800
Spacious 1BR,40.68299,-73.99841,150
Apartment share - Private Bedroom,40.67541,-73.99812,75
Cosy apartment in Carroll Gardens,40.68132,-73.99685,119
Beautiful 1 BR w/ Private Backyard,40.68603,-73.99373,125
"1br w/full ba,spacious and private",40.6835,-74.00168,70
"Sunny Studio, Contact Me for Longer Stays",40.6778,-73.99972,103
Carroll Gardens Brownstone,40.6805,-73.99238,110
"Carroll Gardens, 25 ft from F/G",40.68008,-73.99429,60
Brooklyn Beauty w/private garden!,40.67845,-73.99691,98
Private room with your own backyard,40.67705,-73.99503,100
Carroll Gardens Studio,40.67726,-74.00015,174
1 BDRM APT BROOKLYN (REDHOOK),40.67849,-74.00259,125
Beautiful Apartment in Cobble Hill,40.68493,-73.99264,225
"Spacious, Bright and Comfortable",40.67675,-73.99686,132
Large bright apartment in Carroll Gardens Brooklyn,40.67641,-74.00036,300
Beautiful 1BR  Garden Apt in BK,40.68105,-73.99221,150
"Perfect 2bd-retreat in quaint, foodie area",40.67793,-73.99659,150
Cozy private room w/ensuite bathroom!!,40.6826,-73.99216,95
Huge brownstone apt. on cute block!,40.68187,-73.99735,110
Spacious Apartment w/Patio & Private Entrance,40.68182,-74.00198,125
Garden Apartment in Carroll Gardens,40.67992,-73.99486,195
House On Henry Parlor Apartment,40.67763,-74.001,250
Garden Bedroom in Carroll Gardens Brownstone,40.67796,-73.99587,90
2 bedroom Kid Friendly Cobble Hill,40.68284,-73.99539,182
Basically Your Own Apartment: Cobble Hill Gem,40.68604,-73.99325,120
Private suite in Carroll Gardens,40.67788,-73.99874,110
"Clean and modern in prime Carroll Gardens, BK",40.67643,-74.00014,100
Bright and clean room in a quaint neighborhood,40.67961,-73.9993,150
Cozy room in 2br Cobble Hill apartment,40.68331,-73.99228,90
Comfortable room in a chic and modern house,40.67982,-73.99979,150
CHARMING HOME with TONES OF LIGHT & GREAT DESIGN,40.67878,-73.9977,290
Cozy in Cobble Hill,40.68413,-73.992,450
Quiet Room in Unique Carroll Gardens,40.67741,-73.99866,40
Modern Design Brooklyn Apt w Nursery & Peloton,40.68372,-73.9926,270
Beautiful apartment with sweeping NYC views,40.68346,-73.99898,250
Artists' Room in Beautiful Brownstone Brooklyn,40.67978,-73.99362,95
Sunny Large 3BR Perfect for Families Private Yard,40.6748,-73.99943,200
Sunny Carroll Gardens Share: Suite or Workspace,40.67837,-73.9947,79
Carroll Gardens Modern Sunny Loft,40.67821,-73.99716,300
Immaculate and Sweet Carroll Gardens 1 Bedroom,40.67809,-73.99875,219
Beautiful brownstone apartment on quiet street,40.67833,-73.99824,125
Garden Apartment in Carroll Gardens Brownstone,40.67887,-74.00151,250
Cool town house,40.68391,-73.9919,595
"Spacious, Prime Carroll Gardens, BK Apartment",40.67555,-73.99948,180
"Artist's Townhouse w/ garden, grill -near subway",40.68169,-73.99136,298
Lovely apartment in Brooklyn.,40.68362,-73.99381,125
Sunny 1 bedroom in Carroll Gardens,40.67999,-73.99898,189
The Henry - A One Bedroom Cobble Hill Apartment,40.68496,-74.00026,165
"Huge Room, Modern Unit in Carroll Gardens",40.67575,-73.9983,40
Centrally located modern Brooklyn penthouse,40.6833,-73.99168,350
Serene Studio in Brooklyn,40.68373,-73.99494,156
"Modern Comfort in Carroll Gardens, Brooklyn",40.6782,-73.99627,194
Cozy Brooklyn Designer Apartment,40.68041,-73.9923,121
Brooklyn Flat in prime Carroll Gardens (Room),40.67546,-73.99936,92
Central & Comfortable 1BR Brownstone Apartment,40.68344,-73.99846,210
ENTIRE Spacious Brownstone Apartment (UNFURNISHED),40.67912,-74.0004,50
"Gorgeous summer spot in boerum hill, brooklyn!",40.6846,-73.99069,1333
Quiet Homestead in the city,40.67839,-74.00162,100
Perfect private studio apt in Carroll Gardens.,40.68084,-73.99287,130
Large sunny 1 bedroom  with everything you need,40.68333,-73.9909,150
Entire Garden apartment in Brownstone,40.67765,-74.00127,300
Comfortable Carroll Gardens 2 BR Amazing Location,40.6792,-73.99297,275
Sun-Drenched  Perch in Charming Brownstone,40.68291,-73.99284,150
Luxury pied-à-terre in Carroll Gdns carriage hse,40.67931,-73.99323,282
Charming Carroll Gardens/Gowanus Apartment,40.67889,-73.99458,150
Brownstone Studio,40.67771,-74.00006,170
"Cozy apartment with art, good light & books",40.67532,-73.99981,140
Modern Luxury Brooklyn Zen with Private Garden,40.68373,-73.98995,310
Sunny 2-bedroom Brooklyn Apt with Rooftop Views,40.68337,-73.9915,175
Charming 1 Bedroom Apartment in Carroll Gardens,40.67656,-73.99932,79
Sun-drenched cozy top-floor studio,40.67929,-74.00107,130
Carroll Garden Brownstone Charmer w/ Washer&Dryer,40.68061,-74.00066,100
Modern Renovated 3BR Brooklyn Duplex,40.68222,-73.99179,525
Newly renovated 2BR in Carroll Gardens brownstone,40.67914,-73.99883,279
Charming private room in Brownstone apartment,40.68399,-73.99683,85
Great studio in Carroll Gardens.,40.67896,-74.00067,97
"room in sunny, charming, vintage style apartment",40.68102,-73.99418,129
Charming Cobble Hill Brownstone Apartment,40.68567,-73.99249,230
Spacious Apartment in Brooklyn Townhouse,40.68337,-74.0015,125
Come spend Fall in Carroll Gardens,40.68289,-73.99831,65
Private Studio Apartment in Carroll Gardens,40.68289,-73.99259,60
Spacious 1 bedroom apt with garden access,40.67732,-74.0003,186
Cozy 2 Bedroom Apartment in Carroll Gardens,40.6745,-73.99911,203
Roommate in Carroll Gardens for 3 months,40.67921,-74.00111,75
Bright and Beautiful Top Floor Two Bedrooms,40.68383,-73.99281,200
"Carroll Gardens Chic Apartment, 5 min to Manhattan",40.68312,-73.99143,375
★Homely Spacious Studio | Patio★,40.68023,-74.00107,200
Luxury apartment on Brownstone block,40.68464,-73.99115,129
Court Apartment,40.68538,-73.99329,249
Sanctuary on Smith,40.68324,-73.99268,100
Luxe Brownstone for long stay,40.68195,-73.99448,86
Modern 1BR in Carroll Gardens Landmarked District,40.68185,-73.99297,225
Charming and chic tree-lined Carroll Gardens apt,40.6815,-73.99842,315
Historic Brooklyn Brownstone with Modern Amenities,40.68034,-73.99291,500
MINI PALACE! Artistic apartment in CARROLL GARDENS,40.68192,-73.99712,695
Carroll Gardens Brownstone Apartment,40.68349,-73.99128,199
Designer's Bright Spacious Home w/ Rooftop Oasis,40.68492,-73.99004,240
"*Discount* Stylish, sunny 1bd  in Carroll Gardens",40.67782,-73.9987,226
One Bed Parlor apartment in Brownstone Brooklyn,40.6799,-73.9951,120
Carroll Gardens 1 -Bedroom Apartment,40.68174,-73.99714,175
Cozy and Artsy 1-Bedroom Apt in Carroll Gardens,40.68357,-73.99411,90
"Fully furnished sublet, large room in Brooklyn!",40.67434,-74.00021,900
Adorable 2 Bedroom in the Heart of Carroll Gardens,40.675797,-73.998322,300
Architect designed townhome in Cobble Hill,40.68536,-73.99371,465
Newly Renovated Oasis in Prime Carroll Gardens,40.67914,-73.99889,149
Family friendly 2bd  in Boerum/Cobble Hill,40.6849,-73.98993,230
Calm Spacious Oasis in heart of Brooklyn,40.68483,-73.99104,393
"Spacious, 3-floor 3BR 2.5BA Carriage House in BK",40.68256,-73.99169,541
Refreshed! Full floor/near MTA/lux Carroll Gardens,40.68286,-74.00073,193
Spacious Sun Filled 1-Bedroom in Carroll Gardens,40.68339,-73.99624,292
Summit House 2 Bedroom Apt with Private Garden,40.681412,-74.001175,350
Private Luxury Suite in Brooklyn Brownstone,40.68048,-74.00295,198
"Carroll Gardens 1BR w/ W/D, nr WF & Waterfront",40.6750255,-73.9978519,286
"Carroll Gardens 1BR w/ W/D, nr WF & Waterfront",40.6750255,-73.9978519,196
Stylish 1-bedroom Carroll Gardens apartment,40.68034,-74.00267,200
Lovely Carroll Gardens One Bedroom with Garden.,40.681564,-73.994194,139
"Carroll Gardens 1BR w/ W/D & Private Garden, nr WF",40.6750255,-73.9978519,385
2 bed loft in heart of Carroll Gardens,40.67859,-73.99849,200
Private room in Modern Boerum Hill Apartment,40.68465,-73.99113,196
"Spacious 2BR in Cobble Hill 2BR, Steps from Subway",40.6824525,-73.9931498,46
Sunny Cobble Hill 2BR (Only Steps to the Subway!),40.6824525,-73.9931498,73
Brownstone 1BR Apt. in Carroll Gardens w/Backyard,40.68013759999999,-73.993138,201
"Carroll Gardens 3BR w/ W/D, nr Carroll Park",40.6804,-73.99803,299
Private room in light-filled Carroll Gardens flat,40.67592,-74.00053,120
"Cobble Hill 3BR w/ W/D, nr Carroll Park",40.680404,-73.9980267,303
Serene private Apt in historic Brownstone w/patio,40.67978,-73.9998,200
Sweet Caroline  in Carroll Gardens,40.67777,-73.99963,1000
Studio in Carroll Gardens,40.67634,-73.99931,99
Sunny full-floor home in Historic Carroll Gardens,40.68184,-73.99956,349
Two bedroom in Carroll Gardens,40.67759,-73.99975,400
Sweet Family Pod in Carroll Gardens Brooklyn,40.67827,-74.00011,1500
Snazzy full Apt. in Trendy Carrol Gardens BK-NYC,40.68418,-74.00049,207
Lovely ground floor apt in Boerum Hill,40.68329,-73.99216,275
NEW Sundrenched 1bed apt in CG Brownstone,40.67885,-73.99999,286
Entire Sunny Brownstone w/ Garden Carroll Gardens,40.67997,-73.99543,236
"Room, twin bed, with private bathroom in Brooklyn",40.67997695058514,-73.99505764245987,73
Fabulous BK 3 bd w/ Pvt backyard,40.6767701,-73.9992065,263
Cosy apartment in Cobble Hill,40.683876,-73.9929839,140
